{
  "version": "1.0",
  "repo": "mzfshark/GitIssue-Manager",
  "updatedAt": "2026-01-26T17:48:33.665Z",
  "planFingerprint": "5f3cca792a356e32140672e2198a150718c41401",
  "planFiles": [
    {
      "path": "PLAN.md",
      "sha1": "583973c98d28c944b21aae6af2acf315e3043822"
    }
  ],
  "items": [
    {
      "stableId": "53f77a3f274c68516120fa249eb15c64b200222c",
      "explicitId": "PLAN",
      "kind": "task",
      "issueNumber": 74,
      "issueNodeId": "I_kwDOQ8e5Ls7l5Nmf",
      "issueUrl": "https://github.com/mzfshark/GitIssue-Manager/issues/74",
      "projectItemId": null,
      "title": "#PLAN-002 - Single Source of Truth for Issue Generation (sync-helper + E2E)",
      "source": {
        "file": "PLAN.md",
        "line": 1
      },
      "lastSyncedAt": "2026-01-26T17:48:33.655Z"
    },
    {
      "stableId": "0a60ab8947e6c636730ea634a0d55e2efa870978",
      "explicitId": null,
      "kind": "subtask",
      "issueNumber": 75,
      "issueNodeId": "I_kwDOQ8e5Ls7l5Nna",
      "issueUrl": "https://github.com/mzfshark/GitIssue-Manager/issues/75",
      "projectItemId": null,
      "title": "#PLAN-002 - Single Source of Truth for Issue Generation (sync-helper + E2E)",
      "source": {
        "file": "PLAN.md",
        "line": 1
      },
      "lastSyncedAt": "2026-01-26T17:48:33.655Z"
    },
    {
      "stableId": "7837c1addfbc9ec6be74328e05e06481ecb4d217",
      "explicitId": "PLAN-002",
      "kind": "subtask",
      "issueNumber": 76,
      "issueNodeId": "I_kwDOQ8e5Ls7l5Nn1",
      "issueUrl": "https://github.com/mzfshark/GitIssue-Manager/issues/76",
      "projectItemId": null,
      "title": "PLAN-002:",
      "source": {
        "file": "PLAN.md",
        "line": 44
      },
      "lastSyncedAt": "2026-01-26T17:48:33.655Z"
    },
    {
      "stableId": "e26af39f31331ee11d058cc64100edcb00950266",
      "explicitId": "PLAN-003",
      "kind": "subtask",
      "issueNumber": 77,
      "issueNodeId": "I_kwDOQ8e5Ls7l5No0",
      "issueUrl": "https://github.com/mzfshark/GitIssue-Manager/issues/77",
      "projectItemId": null,
      "title": "PLAN-003 - Per-Repo Registry + ISSUE_UPDATES Apply Engine",
      "source": {
        "file": "PLAN.md",
        "line": 64
      },
      "lastSyncedAt": "2026-01-26T17:48:33.655Z"
    },
    {
      "stableId": "1357316651528db793736112fd28cc214103d559",
      "explicitId": "PLAN-003",
      "kind": "subtask",
      "issueNumber": 78,
      "issueNodeId": "I_kwDOQ8e5Ls7l5Npt",
      "issueUrl": "https://github.com/mzfshark/GitIssue-Manager/issues/78",
      "projectItemId": null,
      "title": "PLAN-003:",
      "source": {
        "file": "PLAN.md",
        "line": 101
      },
      "lastSyncedAt": "2026-01-26T17:48:33.655Z"
    },
    {
      "stableId": "aaea5c471a052b245914adef815ddad123a4e98f",
      "explicitId": "PLAN-001",
      "kind": "subtask",
      "issueNumber": 79,
      "issueNodeId": "I_kwDOQ8e5Ls7l5NqR",
      "issueUrl": "https://github.com/mzfshark/GitIssue-Manager/issues/79",
      "projectItemId": null,
      "title": "PLAN-001 - Fix ProjectV2 GraphQL Variable Handling (GitIssue-Manager)",
      "source": {
        "file": "PLAN.md",
        "line": 116
      },
      "lastSyncedAt": "2026-01-26T17:48:33.655Z"
    },
    {
      "stableId": "eab915c7d759c7eef087fa7d331c4fae21b7af83",
      "explicitId": null,
      "kind": "subtask",
      "issueNumber": 7,
      "issueNodeId": "I_kwDOQ8e5Ls7lIOqW",
      "issueUrl": "https://github.com/mzfshark/GitIssue-Manager/issues/7",
      "projectItemId": "PVTI_lAHOAZZpx84BM1N0zgkGOhs",
      "title": "Make Stage 2 call sync-helper prepare and persist artifact paths",
      "source": {
        "file": "PLAN.md",
        "line": 46
      },
      "lastSyncedAt": "2026-01-26T17:48:33.655Z"
    },
    {
      "stableId": "0898d08f051aa0e2785fe3f6c46c5142dc4e0ac8",
      "explicitId": null,
      "kind": "subtask",
      "issueNumber": 41,
      "issueNodeId": "I_kwDOQ8e5Ls7laN9p",
      "issueUrl": "https://github.com/mzfshark/GitIssue-Manager/issues/41",
      "projectItemId": "PVTI_lAHOAZZpx84BM1N0zgkKccA",
      "title": "Fix Stage 2 plan resolution to use `<repoRoot>/docs/plans/` by default (avoid hardcoded sibling paths)",
      "source": {
        "file": "PLAN.md",
        "line": 47
      },
      "lastSyncedAt": "2026-01-26T17:48:33.655Z"
    },
    {
      "stableId": "8859e9980dd2429ab64d2f60d7565323c0bc1b2c",
      "explicitId": null,
      "kind": "subtask",
      "issueNumber": 42,
      "issueNodeId": "I_kwDOQ8e5Ls7laOAR",
      "issueUrl": "https://github.com/mzfshark/GitIssue-Manager/issues/42",
      "projectItemId": "PVTI_lAHOAZZpx84BM1N0zgkKcc4",
      "title": "Add `gitissuer sync` command (prepare + deploy + registry:update) as a first-class CLI workflow",
      "source": {
        "file": "PLAN.md",
        "line": 48
      },
      "lastSyncedAt": "2026-01-26T17:48:33.655Z"
    },
    {
      "stableId": "ba8a6a903595cd12227751a07e3d426caedc39db",
      "explicitId": null,
      "kind": "subtask",
      "issueNumber": 59,
      "issueNodeId": "I_kwDOQ8e5Ls7leL1l",
      "issueUrl": "https://github.com/mzfshark/GitIssue-Manager/issues/59",
      "projectItemId": null,
      "title": "Make `gitissuer` portable: add `doctor/install` commands and a repo-local zero-config fallback config under `.gitissuer/`",
      "source": {
        "file": "PLAN.md",
        "line": 49
      },
      "lastSyncedAt": "2026-01-26T17:48:33.655Z"
    },
    {
      "stableId": "8990f7412af98282922c9b5261e2cc6c7fc9bfe3",
      "explicitId": null,
      "kind": "subtask",
      "issueNumber": 80,
      "issueNodeId": "I_kwDOQ8e5Ls7l5Nxq",
      "issueUrl": "https://github.com/mzfshark/GitIssue-Manager/issues/80",
      "projectItemId": null,
      "title": "Harden Axodus maintenance scripts (archive/close) to fail closed on API errors and avoid silent hangs (timeouts + logs)",
      "source": {
        "file": "PLAN.md",
        "line": 50
      },
      "lastSyncedAt": "2026-01-26T17:48:33.655Z"
    },
    {
      "stableId": "8902c3a5c9730f56ebc8555e9fd087e071bcea4a",
      "explicitId": null,
      "kind": "subtask",
      "issueNumber": 81,
      "issueNodeId": "I_kwDOQ8e5Ls7l5NyY",
      "issueUrl": "https://github.com/mzfshark/GitIssue-Manager/issues/81",
      "projectItemId": null,
      "title": "Make Stage 3 create/reuse PAI from templates + plan file content",
      "source": {
        "file": "PLAN.md",
        "line": 51
      },
      "lastSyncedAt": "2026-01-26T17:48:33.655Z"
    },
    {
      "stableId": "569369d35df05aa00fd6cc46df9343637a1e7315",
      "explicitId": null,
      "kind": "subtask",
      "issueNumber": 82,
      "issueNodeId": "I_kwDOQ8e5Ls7l5Ny2",
      "issueUrl": "https://github.com/mzfshark/GitIssue-Manager/issues/82",
      "projectItemId": null,
      "title": "Make Stage 4 run executor (idempotent issue upsert) and capture engine-output.json",
      "source": {
        "file": "PLAN.md",
        "line": 52
      },
      "lastSyncedAt": "2026-01-26T17:48:33.655Z"
    },
    {
      "stableId": "f2a719fc9773c9b3fc7f7e20589a95a271ac51a5",
      "explicitId": null,
      "kind": "subtask",
      "issueNumber": 83,
      "issueNodeId": "I_kwDOQ8e5Ls7l5N1j",
      "issueUrl": "https://github.com/mzfshark/GitIssue-Manager/issues/83",
      "projectItemId": null,
      "title": "Add `deploy --dry-run` support in `scripts/gitissuer.sh` (no writes; allow `--link-hierarchy` to dry-run too)",
      "source": {
        "file": "PLAN.md",
        "line": 53
      },
      "lastSyncedAt": "2026-01-26T17:48:33.655Z"
    },
    {
      "stableId": "5af99e9090f1f4b913fa48817ef0f125de5936e8",
      "explicitId": null,
      "kind": "subtask",
      "issueNumber": 84,
      "issueNodeId": "I_kwDOQ8e5Ls7l5N2F",
      "issueUrl": "https://github.com/mzfshark/GitIssue-Manager/issues/84",
      "projectItemId": null,
      "title": "Make Stage 5 link hierarchy based on stableId/parentStableId maps",
      "source": {
        "file": "PLAN.md",
        "line": 54
      },
      "lastSyncedAt": "2026-01-26T17:48:33.655Z"
    },
    {
      "stableId": "a902fe2495ad347a5f21954d852286194e91531c",
      "explicitId": null,
      "kind": "subtask",
      "issueNumber": 85,
      "issueNodeId": "I_kwDOQ8e5Ls7l5N2n",
      "issueUrl": "https://github.com/mzfshark/GitIssue-Manager/issues/85",
      "projectItemId": null,
      "title": "Make Stage 7 update progress via bounded markers (no overwrite)",
      "source": {
        "file": "PLAN.md",
        "line": 55
      },
      "lastSyncedAt": "2026-01-26T17:48:33.655Z"
    },
    {
      "stableId": "9e4aa47302edb40aaf7720e84e8a9f8745208790",
      "explicitId": null,
      "kind": "subtask",
      "issueNumber": 86,
      "issueNodeId": "I_kwDOQ8e5Ls7l5N3J",
      "issueUrl": "https://github.com/mzfshark/GitIssue-Manager/issues/86",
      "projectItemId": null,
      "title": "Define registry schema and report schema",
      "source": {
        "file": "PLAN.md",
        "line": 103
      },
      "lastSyncedAt": "2026-01-26T17:48:33.655Z"
    },
    {
      "stableId": "9dae09c3ba6c579672c66832fcb581f35d09941b",
      "explicitId": null,
      "kind": "subtask",
      "issueNumber": 87,
      "issueNodeId": "I_kwDOQ8e5Ls7l5N3z",
      "issueUrl": "https://github.com/mzfshark/GitIssue-Manager/issues/87",
      "projectItemId": null,
      "title": "Implement registry read/write helpers + atomic update",
      "source": {
        "file": "PLAN.md",
        "line": 104
      },
      "lastSyncedAt": "2026-01-26T17:48:33.655Z"
    },
    {
      "stableId": "1eb5b3a7b02a0969a174430fbc200244ebdc357a",
      "explicitId": null,
      "kind": "subtask",
      "issueNumber": 88,
      "issueNodeId": "I_kwDOQ8e5Ls7l5N4X",
      "issueUrl": "https://github.com/mzfshark/GitIssue-Manager/issues/88",
      "projectItemId": null,
      "title": "Implement ISSUE_UPDATES.md parser with strict validation",
      "source": {